{
  "schema_version": 1,
  "id": "p30-organization-score-release",
  "work_item_id": "p30-organization-score",
  "stage": "release",
  "owner_office": "release",
  "owner_role": "releaser",
  "decision": "completed",
  "source": "lfg-goal",
  "summary": "P30 releases a read-only organization score gate that computes the 9.8 maturity score from current evidence gates.",
  "created_at": "2026-06-18T00:00:00Z",
  "evidence_refs": [
    "docs/organization-score.md",
    "schemas/organization-score-report.schema.json",
    "scripts/gates/organization_score.py",
    "tests/test_regression_organization_score.py"
  ],
  "source_receipts": [
    "tests/fixtures/lfg_goal/receipt_valid.md"
  ],
  "commands": [
    {
      "command": "python -m pytest tests/test_regression_organization_score.py -q",
      "exit_code": 0,
      "evidence": "Focused P30 tests validate schema output, computed score, residual gaps, and missing-input failure."
    }
  ],
  "safety": {
    "mutates_files_by_default": false,
    "external_telemetry": false,
    "auto_runtime_launch": false,
    "irreversible_actions": 0,
    "requires_explicit_emit": true,
    "requires_explicit_work_item_update": true
  }
}
