{
  "schema_version": 1,
  "id": "p28-runtime-stage-receipt-adapter-release",
  "work_item_id": "p28-runtime-stage-receipt-adapter",
  "stage": "release",
  "owner_office": "release",
  "owner_role": "releaser",
  "decision": "completed",
  "source": "lfg-goal",
  "summary": "P28 adds a schema-backed organization stage receipt adapter with explicit local emission and explicit work-item update modes.",
  "created_at": "2026-06-18T00:00:00Z",
  "evidence_refs": [
    "docs/organization-stage-receipts.md",
    "schemas/organization-stage-receipt.schema.json",
    "schemas/organization-stage-receipt-report.schema.json",
    "scripts/gates/organization_stage_receipt.py",
    "tests/test_regression_organization_stage_receipt.py"
  ],
  "source_receipts": [
    "tests/fixtures/lfg_goal/receipt_valid.md"
  ],
  "commands": [
    {
      "command": "python -m pytest tests/test_regression_organization_stage_receipt.py -q",
      "exit_code": 0,
      "evidence": "Focused P28 tests validate read-only gate mode, explicit emission, LFG-goal source receipt checks, and explicit work-item update."
    }
  ],
  "safety": {
    "mutates_files_by_default": false,
    "external_telemetry": false,
    "auto_runtime_launch": false,
    "irreversible_actions": 0,
    "requires_explicit_emit": true,
    "requires_explicit_work_item_update": true
  }
}
